firstName,lastName,company,title,biography,facebookUrl,twitterUrl,linkedInUrl,profileImageUri,links
DANIEL P,CARUSO,Caruso Ventures,Managing Director,"Dan Caruso was Chairman and CEO at Zayo Group, a company he co-founded in 2007. Zayo was Dan’s 3rd Fiber Bandwidth startup. Dan joined Metropolitan Fiber Systems (MFS) as it began to scale and was part of the exec team that launched Level 3. All three exited for > $10B. Dan also led the take private of ICG, which achieved a 25X return and led to the ideation of Zayo. 

Beyond his role at Zayo, Dan is an avid supporter of Colorado’s and Chicago’s entrepreneurial community. He currently serves as Chairman of the Board for Endeavor Colorado and serves on the boards of Colorado Thrives, University of Chicago’s Polsky Center and CU Boulder’s Chancellor Strategic Advisory Council. Dan holds an MBA from the University of Chicago and a B.S. in Engineering from the University of Illinois.",,,https://www.linkedin.com/in/dan-caruso-7b6b6/,https://custom.cvent.com/a8c8ec4c05104789a0eb595eac25b252/files/event/6d45431e0aef41c8b8ac9ec3f7c1d5b1/282922b3511c486c9d8f73ad02843b18.png,WEBSITE - https://carusoventures.com/
DEVIN,DE WULF,Krewe of Red Beans / Feed the Second Line,Founder,"Devin De Wulf is a former middle-school social studies teacher, folk-artist, and stay-at-home dad of two. He is also the founder and organizer of the Krewe of Red Beans, a Lundi Gras marching parade. 

Since COVID began, Devin has led the Krewe of Red Beans in a series of inspiring community-support efforts. The first, Feed the Front Line NOLA was inspired by his wife, an ER doctor at UMC. Beginning with a $60 order of food and an email to his krewe, Devin helped create the largest restaurant-food-to-hospital-worker effort in America. $1.2 million raised in 6 weeks, 90,000 meals to every single ER and ICU in New Orleans (From St. Bernard to Kenner), 10,000 cookies and coffees, and $100,000 in delivery gigs for musicians. 

Then the krewe created ""Feed the Second Line"", which has created $300,000 in gig-work for musicians and black-masking Indians (grocery shopping, beadwork designs) and $130,000 in groceries for culture-bearer elders. This effort is ongoing. 

Devin also led in the creation of ""Hire A Mardi Gras Artist"" which has put 45 Mardi Artists to work and raised over $250,000",,,,https://custom.cvent.com/a8c8ec4c05104789a0eb595eac25b252/files/event/6d45431e0aef41c8b8ac9ec3f7c1d5b1/c49798130ef84364a3dc921ef37ad273.jpg,FEED THE SECOND LINE - https://www.feedthesecondline.org/ ; RED BEANS PARADE - https://www.instagram.com/redbeansparade/
MEAGHAN,MCCORMACK,St. Bernard Economic Development Foundation (SBEDF),Executive Director,"she/her/hers

As Executive Director of SBEDF, Meaghan seeks to create a vibrant business ecosystem full of opportunity and connectivity in St. Bernard Parish. With her experience in small business development, collaborative innovation, and program management, McCormack has already been acknowledged as a City Business Women of the Year (2019) and GNO Inc Millennial Award in Economic Development Finalist (2019). Prior to her role at St. Bernard Economic Development Foundation, Meaghan worked with the World Trade Center of New Orleans & Goldman Sachs 10,000 Small Businesses Program. She is a graduate of Loyola University.",,,https://www.linkedin.com/in/meaghanmccormack/,https://custom.cvent.com/a8c8ec4c05104789a0eb595eac25b252/files/event/6d45431e0aef41c8b8ac9ec3f7c1d5b1/0966909722a14aa6876f9aefbea76e77.png,WEBSITE - https://www.sbedf.org/
ALLISON,SCHILLER,trepwise,"Director of Innovation, Advisor","she/her/hers

Allison Schiller is an Advisor and Director of Innovation at trepwise, bringing her experience in architecture and design thinking to work with organizations in discovering, exploring, and developing user-centric solutions to complex challenges. Allison has worked with clients to facilitate conversations, workshops and creative strategic planning, bringing design research, collaboration and optimism to diverse topics such as campus mental health, organizational growth, board development, digital equity, HR practice evaluation, and disaster preparedness.

Allison Schiller received a B.A. in film studies and creative writing from the University of California at Santa Barbara. In 2008, Allison moved to New Orleans where she earned her master’s degree in architecture from the Tulane School of Architecture, spending two semesters working on design/build projects, including the award-winning Grow Dat Youth Farm project and the Delassize community garden in the Central City neighborhood. These experiences deepened Schiller’s commitment to public interest design and community engagement.",,,https://www.linkedin.com/in/allison-schiller2118/,https://custom.cvent.com/a8c8ec4c05104789a0eb595eac25b252/files/event/6d45431e0aef41c8b8ac9ec3f7c1d5b1/c8f1cd2342ba47e1a79c56f715dc0a8b.jpg,WEBSITE - http://trepwise.com/
ROCSEAN,SPENCER,New Orleans Ernest N. Morial Convention Center,Director of the Small Business Program,"Rocsean Spencer, CCA is the Small Business Program Director for New Orleans Ernest N. Morial Convention Center and industry leader in conventions and tradeshows. The Ernest N. Morial New Orleans Exhibition Hall Authority (“Authority”), the Convention Center’s governing board, created the position to promote the importance of diversity, inclusion and small business development at the Convention Center.

In this role, Mrs. Spencer is tasked with developing and managing the Small and Emerging Business Opportunity Program, and serves as liaison between the Authority, internal stakeholders and the community.

Mrs. Spencer comes to the Convention Center from the City of New Orleans, Office of Supplier Diversity(OSD) where she served as the Department Lead. Prior to that tenure she served in OSD as a Intern, Certification Officer, Compliance Officer and also the Certification Coordinator overseeing the SLDBE certification department.

Mrs. Spencer earned her B.A. in Public Administration from Southern University at New Orleans. She also earned her Contract Compliance Administrator Certification from American Contract Compliance Association and Morgan State University for Continuing and Professional Studies.

In addition to her memberships in several professional and community organizations, Mrs. Spencer serves as a committee member on the City of New Orleans, SLDBE Appeals Committee.

Aside from her professional life, Mrs. Spencer is the wife of 25 yrs. to Mr. Duane Spencer and together they have three sons.",,,,https://custom.cvent.com/a8c8ec4c05104789a0eb595eac25b252/files/event/6d45431e0aef41c8b8ac9ec3f7c1d5b1/7d1767c149194ecb8fb3f68ca4421565.jpg,WEBSITE - https://exhallnola.com/
KAYTI CHUNG,WILLIAMS,Launch NOLA,Director,"she/her/hers

Kayti Chung-Williams is the Director of Launch NOLA.  Being an entrepreneur herself, she has strived to turn every opportunity into equity.  Through Launch NOLA, Kayti supports entrepreneurs in New Orleans through coaching and  facilitating the Business Academy. Launch NOLA has two academies for entrepreneurs:  General Business and Green Infrastructure.",https://www.facebook.com/LaunchNOLA,,,https://custom.cvent.com/a8c8ec4c05104789a0eb595eac25b252/files/event/6d45431e0aef41c8b8ac9ec3f7c1d5b1/46657ce4b2c14c3f8ddc54e113c234aa.jpg,WEBSITE - https://www.launchnola.org/
JOSEPH F.,LAVIGNE,Jones Walker LLP,Partner,"Joe Lavigne is a partner in Jones Walker LLP’s Labor & Employment Practice Group in New Orleans, LA.

As a lead attorney on Jones Walker’s trade secret and non-compete team, Joe focuses his practice on prosecuting and defending claims of employee misconduct involving trade secret violations, unfair trade practices, non-compete violations, invasion of privacy, Computer Fraud and Abuse Act issues, theft, and related disputes. Clients look to Joe to handle high-stakes litigation necessary to protect confidential, proprietary, and trade secret information and to vigorously defend them when unfounded misappropriation claims are made. He also advises clients on employment policies and practices and regularly negotiates employment agreements for employers.

A founding member of The Trade Secret Insider, Joe presents regularly at legal and industry conferences, where he speaks on issues related to protecting confidential and trade secret information, and prosecuting and defending claims regarding the same.",,,https://www.linkedin.com/in/joseph-lavigne-438504b/,https://custom.cvent.com/a8c8ec4c05104789a0eb595eac25b252/files/event/6d45431e0aef41c8b8ac9ec3f7c1d5b1/b6f7ae691d5e41b1b0312f2096a2667b.jpg,WEBSITE - https://www.joneswalker.com/professionals/joseph-f-lavigne.html
TRIXIE,MINX,Trixie Minx Productions,Artistic Director & Owner,"she/her/hers

Trixie Minx is a a producer/performer based in New Orleans, LA. Her company, Trixie Minx Productions, creates custom curated shows with her team of performing artists for both public events & private functions. As performer she is best known for her classic style of dance infused with her trademark comic twist. 
Beyond the stage Trixie also volunteers her time as a advocate for affordable performer healthcare with the New Orleans Musicians Clinic. And on a ridiculous note she LOVES cheese & is currently the reigning Queen of the Fete de Fromage.",,https://twitter.com/TrixMinx,https://www.linkedin.com/in/trixieminx/,https://custom.cvent.com/a8c8ec4c05104789a0eb595eac25b252/files/event/6d45431e0aef41c8b8ac9ec3f7c1d5b1/b83649c30e3c4010a70ca17775896fba.jpg,WEBSITE - https://www.trixieminx.com/
MYLA REESE,POREE,"TruFund Financial Services, Inc.",VP / Director of Business Resiliency and Disaster Recovery,"she/her/hers

Myla Poree is a native of New Orleans, LA. She is the Vice President/Director of Business Resiliency and Disaster Recovery for TruFund Financial Services. Mrs. Poree has been with TruFund for over 13 years, serving as the Managing Director for the Louisiana Offices, Technical Assistance Coordinator and Program Manager of the Southeast Louisiana Fisheries Assistance Center. As the Director, Myla oversees the design of development services that provide comprehensive support to TruFund's borrowers, as well as disaster impact strategy for small businesses in all regions. Over the last 12 years Myla has been integral in the development, implementation, and delivery of all disaster programs at TruFund.  Myla has been invited as a speaker at several events, including United Nations Civil Society Sustainability Conference where she delivered a presentation on Disaster Recovery and Business Resiliency.  She received her B.S. in Business Administrations from Xavier University and M.B.A. from Texas Southern University.",,,https://www.linkedin.com/in/myla-poree-5237628/,https://custom.cvent.com/a8c8ec4c05104789a0eb595eac25b252/files/event/6d45431e0aef41c8b8ac9ec3f7c1d5b1/207f4de3635945fcbc9a9b29beccaa7d.png,WEBSITE - https://www.trufund.org/
KENNY,WELCOME,JPMorgan Chase & Co.,Banker,"he/him/his

Kenny is a Private Banker for J.P. Morgan Private Bank, joining the firm in 2017.  As a Private Banker, Kenny works strategically with clients in the high & ultra high net-worth space ranging from professional athletes & entertainers, corporate executives, business owners, and much more.  Kenny advises his clients on all aspects of banking, lending, investments, and wealth planning.

Prior to J.P. Morgan, Kenny began his career in Wealth Management at Morgan Stanley working as a strategic partner in their Global Sports and Entertainment Division. As one of the youngest advisor in Morgan Stanley’s Sports and Entertainment Division, Kenny tactically utilized his skillset and network to manage and develop relationships with some of the biggest athletes in sports. 

As a New Orleans native, Kenny is very intentional about pouring back into his community and continuing to do his part in the ongoing social and economic expansion of the city. Kenny is a member of the leadership team for NBA All Star and Olympic Gold Medalist, Jrue and Lauren Holiday’s Social Justice Fund, a progressive commitment made to support Black-led non-profit organization, city wide-initiatives seeking to bring about equitable outcomes for black and brown communities, and historically back colleges and universities of higher education in New Orleans, Los Angeles, and Indianapolis. 

Kenny serves on the Board of Full of Grace Foundation, Executive Mentor Council for Son of a Saint, Operations Committee for FirstLine Schools, a member of the Urban League of Louisiana, the Young Leadership Council, New Orleans Regional Black Chamber of Commerce, and the Tulane Alumni Association. 

Kenny earned a Bachelor’s of Science in Business Management and Marketing from Tulane University where he also lettered in football as a scholarship athlete.

Kenny is married to his lovely wife, Naomi Welcome.",,,https://www.linkedin.com/in/kenny-welcome-02575069/,https://custom.cvent.com/a8c8ec4c05104789a0eb595eac25b252/files/event/6d45431e0aef41c8b8ac9ec3f7c1d5b1/2bb4552ab3874096905180688b825557.jpeg,WEBSITE - https://www.jpmorganchase.com/impact/people/advancing-black-pathways
ELDORA L.,"ELLISON, Ph.D.","Sterne, Kessler, Goldstein & Fox",Director,"she/her/hers

Eldora L. Ellison, Ph.D., is a director in Sterne Kessler’s Biotechnology & Chemical and Trial & Appellate Practice Groups. Eldora is a Co-Chair of the firm’s Patent Office Litigation Practice and a member of the firm's Executive Committee. Over the course of her 26-year career, Eldora has gained extensive experience in inter partes patent matters, building on a strong foundation in patent prosecution. Her experience includes representing clients in over 70 inter partes review and post-grant review proceedings, more than 15 patent interferences, and in various patent reexaminations and district court litigations. She was designated lead patent strategist for the University of California on its ground-breaker CRISPR technology and has led the University’s renewed interference proceedings. Eldora earned her J.D. from Georgetown University Law Center, her Ph.D. in biochemistry, molecular and cell biology from Cornell University, and her B.S. in biology from Haverford College.",,https://twitter.com/SterneKessler,https://www.linkedin.com/in/eldora-ellison-21703b7/,https://custom.cvent.com/a8c8ec4c05104789a0eb595eac25b252/files/event/6d45431e0aef41c8b8ac9ec3f7c1d5b1/190095e9a32b4a42859dcd82663c4bb1.jpg,WEBSITE - https://www.sternekessler.com/
MARLON,NICHOLS,MaC Venture Capital,Managing Partner,"he/him/his

Marlon Nichols is the founding managing partner at MaC Venture Capital (formerly Cross Culture Ventures), which finds entrepreneurs who are building the future for the rest of America.

He’s a former Kauffman Fellow and Investment Director at Intel Capital, with an extensive background in technology, private equity, media and entertainment. Marlon’s unique eye for global trends and shifts in consumer behavior has helped him capture many high-potential investments and companies that reflect overlooked markets, including Gimlet Media, MongoDB, Thrive Market, PlayVS, Fair, LISNR, Mayvenn, Blavity, and Wonderschool.

Marlon is the recipient of MVMT50’s SXSW 2018 Innovator of the Year award, Digital Diversity’s Innovation & Inclusion Change Agent award and was a TechWeek 100 winner. He was named Pitchbook’s 25 Black Founders and VCs to Watch in 2018 and 2019 and one of Silicon Republic's 26 VC professionals spearheading change. He’s been featured on TechCrunch, Fortune, Blavity and NBC, and is adjunct faculty in entrepreneurship and venture capital at the SC Johnson College of Business at Cornell University.",,https://twitter.com/marloncnichols,https://www.linkedin.com/in/marloncnichols/,https://custom.cvent.com/a8c8ec4c05104789a0eb595eac25b252/files/event/6d45431e0aef41c8b8ac9ec3f7c1d5b1/fc6d807638ee421cacecaa496801c33c.png,WEBSITE - https://macventurecapital.com/
WILL,BIHRLE,Bain Capital Private Equity,Principal,"Mr. Bihrle joined Bain Capital Private Equity in 2014.  He is a Principal in the Technology, Media & Telecommunications Vertical and is a member of the North American Private Equity team.

Prior to joining Bain Capital Private Equity, Mr. Bihrle was an associate at Berkshire Partners. Before Berkshire Partners, Mr. Bihrle was a consultant at Bain and Company.",,,,https://custom.cvent.com/a8c8ec4c05104789a0eb595eac25b252/files/event/6d45431e0aef41c8b8ac9ec3f7c1d5b1/a6ec962204074bf4b8ce1c56ff55dc2a.jpg,WEBSITE - https://www.baincapital.com/
LEYONNA,BARBA,JPMorgan Chase & Co.,Executive Director,"she/her/hers

Leyonna is an Executive Director in J.P. Morgan’s Commercial Bank, managing client relationships in the Technology and Disruptive Commerce banking practice in Middle Market Banking that serves high growth companies from seed stage through IPO or exit. Advising clients at every stage in their growth profile, early to late stage, she is a skilled professional in an array of solutions ranging from operational optimizations, cash management, international growth and debt financing.

Prior to working in the early stage banking group, Leyonna worked 15+ years in the investment and corporate banking practices at J.P. Morgan. She started her career in Debt Capital Markets advising clients on capital structure, M&A financing, leverage recapitalization and liability management. 

Leyonna earned a M.B.A. from Columbia University and a B.S. in Business Administration with a concentration in Finance and Accounting from Washington University in St. Louis. She is the former President of the New York Alumnae chapter of Delta Sigma Theta Sorority, Inc. and remains an active member. Leyonna currently resides in New Jersey with her son.",,https://twitter.com/LeyonnaInTech,https://www.linkedin.com/in/leyonnabarba/,https://custom.cvent.com/a8c8ec4c05104789a0eb595eac25b252/files/event/6d45431e0aef41c8b8ac9ec3f7c1d5b1/f5763ab7070e4f7287be495a28d28b5a.jpg,WEBSITE - www.jpmorgan.com/startups
LISA P.,JACKSON,Apple,"Vice President of Environment, Policy and Social Initiatives","Lisa P. Jackson is Apple’s Vice President of Environment, Policy and Social Initiatives, and served as Administrator of the U.S. Environmental Protection Agency from 2009 to 2013.

At Apple, Lisa leads the company’s environmental initiatives, global community education programs, product accessibility efforts, corporate giving, and worldwide government affairs. She is also the head of Apple’s newly announced Racial Equity and Justice Initiative.

Since Lisa’s arrival in 2013, Apple has transformed its environmental footprint. Under her leadership, the company reached its goal of powering its operations around the world with 100 percent renewable energy and is now implementing its industry-leading supplier clean energy program — responsible for adding over 5 gigawatts of new clean energy around the world — to drive the transition to renewable energy with Apple’s manufacturing partners. In addition, Lisa spearheads Apple’s circular economy programs, grounded in the company’s ambition to one day make its products using only recycled or renewable materials.

President Barack Obama appointed Lisa as Administrator of the U.S. Environmental Protection Agency in 2009 — the first African-American to hold the position. As Administrator, she focused on reducing greenhouse gases, protecting air and water quality, preventing exposure to toxic contamination, and achieving environmental justice by expanding environmental outreach to underserved communities and communities of color.

Lisa has been recognized as a leader in business and sustainability in a number of leading publications including Fast Company’s 100 Most Creative People in Business, Vogue’s Game Changers, InStyle’s Badass Women, Newsweek’s Most Important People, TIME Magazine’s 100 Most Influential People in the World (2010 & 2011) and Ebony’s Power 100 lists. She is the recipient of numerous awards, including Princeton’s James Madison Medal, Tulane University’s Distinguished Alumni Award, the Environmental Law Institute’s Environmental Achievement Award, the Corporate EcoForum’s C.K. Prahalad Award for Global Sustainability Business Leadership and The Captain Planet Foundation’s Protector of the Earth Award.

She serves on the boards of Tulane University, SF Film, Conservation International and Emily’s List, and is an honorary member of Delta Sigma Theta sorority.",,,,https://custom.cvent.com/a8c8ec4c05104789a0eb595eac25b252/files/event/6d45431e0aef41c8b8ac9ec3f7c1d5b1/572604721fcc4fd79aa6fa944a7bb62e.jpg,
JESSICA,DANDRIDGE,Water Collaborative of Greater New Orleans,Executive Director,"she/her/hers

Ms. Dandridge received her B.A at Xavier University of Louisiana in political science and sociology. She received her M.A in International Affairs with a concentration in security and conflict from The New School for Public Engagement in New York City. Since 2005, she has worked with over 20 organizations nationally on various projects. Before starting at the TWC, Ms. Jessica was the Louisiana State Director at the Campaign Election Engagement Project and the Program Director for Rural Electric Cooperative Democracy Project for the Rockefeller Family Fund. Ms. Dandridge has a certificate in Leadership, Activism, and Civil Rights from Brown University, and a certificate in Kingian Nonviolence Strategies from the Selma Center of Nonviolence. She currently acts as the chair of the Region 8 Louisiana Watershed Initiative and co-found, and manages the People’s Water Project, a national coalition of organizations and leaders fighting for progressive federal water policies.",,,https://www.linkedin.com/in/jessica-dandridge-ma-1ba73071/,https://custom.cvent.com/a8c8ec4c05104789a0eb595eac25b252/files/event/6d45431e0aef41c8b8ac9ec3f7c1d5b1/4c07757fbc754eb9b45689ed7a36f415.jpg,WEBSITE - https://www.nolawater.org/
PATRICK,RILEY,GAN,CEO,"Patrick Riley is the CEO of GAN which is a highly-curated community of independent accelerators, corporates, and investors. GAN connects startups to the human and financial resources they need so that entrepreneurs and the cities they call home become increasingly whole. He's also Managing Partner of GAN Ventures, the VC fund associated with GAN.

He started his career at the American Red Cross where he oversaw the COO's office as its Chief of Staff. Patrick left the Red Cross to manage the sales and operations for a venture-backed healthcare technology company that had a recent exit. Following his passion to support start-up companies around the world, Patrick joined Techstars, a well known tech accelerator, and oversaw its growth which included the development of GAN. Outside of work, he enjoys spending time with his wife and two girls, bike riding, traveling, and skiing around Colorado.",,https://twitter.com/ganconnect,https://www.linkedin.com/in/rileypat/,https://custom.cvent.com/a8c8ec4c05104789a0eb595eac25b252/files/event/6d45431e0aef41c8b8ac9ec3f7c1d5b1/06a0fc8a5829491d804ee59abfabbc34.jpg,WEBSITE - https://www.gan.co
TOURÉ,FOLKES,Turning Tables,CEO/Executive Director,"Born in NYC and shaped by many places along the east coast and south, Touré Folkes now calls New Orleans his home.  Having sparked his bartending career in NYC, Touré moved down south and continued his growth in the New Orleans food and beverage community.  Currently, Toure´Folkes is the Executive Director and CEO of Turning Tables.  Turning Tables creates a foundation for equity in the bartending and hospitality community by providing mentorship, educational tools, and a network of support for BIPOC hospitality professionals. Turning Tables seeks to change the face of hospitality by investing in the success of our communities and cultivating leadership within our city.  Turning Tables looks at the industry as a whole and collaborates with partners in every sector to envision a new future for hospitality.",https://www.facebook.com/turningtablesnola,,,https://custom.cvent.com/a8c8ec4c05104789a0eb595eac25b252/files/event/6d45431e0aef41c8b8ac9ec3f7c1d5b1/f3e330682e034239a806d6cc75d09542.jpg,INSTAGRAM - https://www.instagram.com/turningtablesnola ; WEBSITE - https://www.turningtablesnola.org/
SABRINA,SHORT,NOLAvate Black,Founder & CEO,"she/her/hers

Sabrina Short is the Founder and Chief Executive Officer of NOLAvate Black, New Orleans Black Tech Collective. She is known as the “Great Connector” because of her unwavering passion for community and social justice. 

A 2019 and 2020 Ada Lovelace Award nominee for women making an impact in tech, Sabrina raises awareness around diversity and inclusion in the technology sector. Sabrina strives to explore ways to support the local tech ecosystem, including spearheading the Black Tech NOLA, the regions first  Inclusive Innovation Conference. NOLAvate Black has reached over 2,000 Black professionals through programming that addresses accessibility to the tech pipeline. She is also been named a 2020 Silicon Bayou 100 Honoree and was a 2020 Tech2Empower Fellow with Wake International.

A motivational speaker, published author, community advocate and now a start-up founder, Sabrina believes, “It is important that we create spaces where everyone is invited, supported and included. We each have a divine right to live out our purpose and be successful in doing what we love.”

Sabrina serves on the boards of Rooted School New Orleans and is a member of the New Orleans Digital Alliance.",,https://twitter.com/nolavateblack,https://www.linkedin.com/company/nolavate-black / linkedin.com/in/sabrinanshort,https://custom.cvent.com/a8c8ec4c05104789a0eb595eac25b252/files/event/6d45431e0aef41c8b8ac9ec3f7c1d5b1/38fcec9ab5b047b08163d27ee4910d0c.jpeg,WEBSITE - https://nolavateblack.com/
